{
  "schemaVersion": 1,
  "meta": {
    "channel": "meta-ads",
    "lastSyncedAt": "2026-08-10T09:03:11+05:30",
    "earliestRecordDate": "2026-05-01",
    "latestRecordDate": "2026-08-09",
    "coworkRunId": "run_2026-08-10T0900",
    "syncSource": "Meta Marketing API",
    "rowCounts": {
      "facts": 292
    }
  },
  "dimensions": {
    "adSets": [
      {
        "adSetId": "as-construction-au-11jun",
        "adSetName": "Construction Co. Australia",
        "campaignId": "camp-construction-au",
        "campaignName": "Construction AU",
        "launchDate": "2026-06-11",
        "region": "AU"
      },
      {
        "adSetId": "as-bc-3-emirates",
        "adSetName": "Business Central — 3 Emirates",
        "campaignId": "camp-bc-3-emirates",
        "campaignName": "Business Central Emirates",
        "launchDate": "2026-06-03",
        "region": "AE/ME"
      },
      {
        "adSetId": "as-azure-india-video",
        "adSetName": "Azure — India (Video)",
        "campaignId": "camp-azure-india",
        "campaignName": "Azure Migration India",
        "launchDate": "2026-06-22",
        "region": "IN/Kerala"
      },
      {
        "adSetId": "as-azure-srilanka-video",
        "adSetName": "Azure — Sri Lanka (Video)",
        "campaignId": "camp-azure-srilanka",
        "campaignName": "Azure Migration Sri Lanka",
        "launchDate": "2026-06-22",
        "region": "LK"
      },
      {
        "adSetId": "as-bc-au-11jun",
        "adSetName": "Business Central — Australia",
        "campaignId": "camp-bc-au",
        "campaignName": "Business Central AU",
        "launchDate": "2026-06-11",
        "region": "AU"
      },
      {
        "adSetId": "as-bc-uae-sa",
        "adSetName": "Business Central — UAE & SA",
        "campaignId": "camp-bc-uae-sa",
        "campaignName": "Business Central UAE & SA",
        "launchDate": "2026-06-01",
        "region": "AE/SA"
      },
      {
        "adSetId": "as-construction-au-17jun",
        "adSetName": "Construction Co. Australia",
        "campaignId": "camp-construction-au",
        "campaignName": "Construction AU",
        "launchDate": "2026-06-17",
        "region": "AU"
      },
      {
        "adSetId": "as-bc-au-17jun",
        "adSetName": "Business Central — Australia",
        "campaignId": "camp-bc-au",
        "campaignName": "Business Central AU",
        "launchDate": "2026-06-17",
        "region": "AU"
      },
      {
        "adSetId": "as-azure-tn",
        "adSetName": "Azure — Tamil Nadu",
        "campaignId": "camp-azure-tn",
        "campaignName": "Azure Migration TN",
        "launchDate": "2026-05-22",
        "region": "IN/TN"
      },
      {
        "adSetId": "as-bc-middle-east",
        "adSetName": "Business Central — Middle East",
        "campaignId": "camp-bc-me",
        "campaignName": "Business Central Middle East",
        "launchDate": "2026-06-11",
        "region": "ME"
      },
      {
        "adSetId": "as-bc-au-video-22jun",
        "adSetName": "BC Australia — Video",
        "campaignId": "camp-bc-au",
        "campaignName": "Business Central AU",
        "launchDate": "2026-06-22",
        "region": "AU"
      },
      {
        "adSetId": "as-azure-managed-india",
        "adSetName": "Azure Managed — India",
        "campaignId": "camp-azure-managed-india",
        "campaignName": "Azure Managed India",
        "launchDate": "2026-06-29",
        "region": "IN"
      },
      {
        "adSetId": "as-bc-au-10jun",
        "adSetName": "Business Central — Australia",
        "campaignId": "camp-bc-au",
        "campaignName": "Business Central AU",
        "launchDate": "2026-06-10",
        "region": "AU"
      }
    ]
  },
  "facts": [
    {
      "date": "2026-06-11",
      "adSetId": "as-construction-au-11jun",
      "country": "AU",
      "spend": 462.79,
      "impressions": 269,
      "reach": 149,
      "clicks": 6,
      "conversations": 2
    },
    {
      "date": "2026-06-12",
      "adSetId": "as-construction-au-11jun",
      "country": "AU",
      "spend": 462.79,
      "impressions": 269,
      "reach": 149,
      "clicks": 6,
      "conversations": 2
    },
    {
      "date": "2026-06-13",
      "adSetId": "as-construction-au-11jun",
      "country": "AU",
      "spend": 462.78,
      "impressions": 269,
      "reach": 149,
      "clicks": 6,
      "conversations": 1
    },
    {
      "date": "2026-06-14",
      "adSetId": "as-construction-au-11jun",
      "country": "AU",
      "spend": 462.78,
      "impressions": 269,
      "reach": 149,
      "clicks": 6,
      "conversations": 1
    },
    {
      "date": "2026-06-15",
      "adSetId": "as-construction-au-11jun",
      "country": "AU",
      "spend": 462.78,
      "impressions": 269,
      "reach": 149,
      "clicks": 6,
      "conversations": 1
    },
    {
      "date": "2026-06-16",
      "adSetId": "as-construction-au-11jun",
      "country": "AU",
      "spend": 462.78,
      "impressions": 269,
      "reach": 149,
      "clicks": 5,
      "conversations": 1
    },
    {
      "date": "2026-06-17",
      "adSetId": "as-construction-au-11jun",
      "country": "AU",
      "spend": 462.78,
      "impressions": 269,
      "reach": 149,
      "clicks": 5,
      "conversations": 1
    },
    {
      "date": "2026-06-18",
      "adSetId": "as-construction-au-11jun",
      "country": "AU",
      "spend": 462.78,
      "impressions": 269,
      "reach": 149,
      "clicks": 5,
      "conversations": 1
    },
    {
      "date": "2026-06-19",
      "adSetId": "as-construction-au-11jun",
      "country": "AU",
      "spend": 462.78,
      "impressions": 268,
      "reach": 149,
      "clicks": 5,
      "conversations": 1
    },
    {
      "date": "2026-06-20",
      "adSetId": "as-construction-au-11jun",
      "country": "AU",
      "spend": 462.78,
      "impressions": 268,
      "reach": 149,
      "clicks": 5,
      "conversations": 1
    },
    {
      "date": "2026-06-21",
      "adSetId": "as-construction-au-11jun",
      "country": "AU",
      "spend": 462.78,
      "impressions": 268,
      "reach": 148,
      "clicks": 5,
      "conversations": 1
    },
    {
      "date": "2026-06-22",
      "adSetId": "as-construction-au-11jun",
      "country": "AU",
      "spend": 462.78,
      "impressions": 268,
      "reach": 148,
      "clicks": 5,
      "conversations": 1
    },
    {
      "date": "2026-06-23",
      "adSetId": "as-construction-au-11jun",
      "country": "AU",
      "spend": 462.78,
      "impressions": 268,
      "reach": 148,
      "clicks": 5,
      "conversations": 1
    },
    {
      "date": "2026-06-24",
      "adSetId": "as-construction-au-11jun",
      "country": "AU",
      "spend": 462.78,
      "impressions": 268,
      "reach": 148,
      "clicks": 5,
      "conversations": 1
    },
    {
      "date": "2026-06-25",
      "adSetId": "as-construction-au-11jun",
      "country": "AU",
      "spend": 462.78,
      "impressions": 268,
      "reach": 148,
      "clicks": 5,
      "conversations": 1
    },
    {
      "date": "2026-06-26",
      "adSetId": "as-construction-au-11jun",
      "country": "AU",
      "spend": 462.78,
      "impressions": 268,
      "reach": 148,
      "clicks": 5,
      "conversations": 1
    },
    {
      "date": "2026-06-27",
      "adSetId": "as-construction-au-11jun",
      "country": "AU",
      "spend": 462.78,
      "impressions": 268,
      "reach": 148,
      "clicks": 5,
      "conversations": 1
    },
    {
      "date": "2026-06-28",
      "adSetId": "as-construction-au-11jun",
      "country": "AU",
      "spend": 462.78,
      "impressions": 268,
      "reach": 148,
      "clicks": 5,
      "conversations": 1
    },
    {
      "date": "2026-06-29",
      "adSetId": "as-construction-au-11jun",
      "country": "AU",
      "spend": 462.78,
      "impressions": 268,
      "reach": 148,
      "clicks": 5,
      "conversations": 1
    },
    {
      "date": "2026-06-30",
      "adSetId": "as-construction-au-11jun",
      "country": "AU",
      "spend": 462.78,
      "impressions": 268,
      "reach": 148,
      "clicks": 5,
      "conversations": 1
    },
    {
      "date": "2026-06-03",
      "adSetId": "as-bc-3-emirates",
      "country": "AE",
      "spend": 158.65,
      "impressions": 314,
      "reach": 209,
      "clicks": 3,
      "conversations": 1
    },
    {
      "date": "2026-06-04",
      "adSetId": "as-bc-3-emirates",
      "country": "AE",
      "spend": 158.65,
      "impressions": 314,
      "reach": 209,
      "clicks": 3,
      "conversations": 1
    },
    {
      "date": "2026-06-05",
      "adSetId": "as-bc-3-emirates",
      "country": "AE",
      "spend": 158.65,
      "impressions": 314,
      "reach": 209,
      "clicks": 3,
      "conversations": 1
    },
    {
      "date": "2026-06-06",
      "adSetId": "as-bc-3-emirates",
      "country": "AE",
      "spend": 158.65,
      "impressions": 314,
      "reach": 209,
      "clicks": 3,
      "conversations": 1
    },
    {
      "date": "2026-06-07",
      "adSetId": "as-bc-3-emirates",
      "country": "AE",
      "spend": 158.65,
      "impressions": 314,
      "reach": 209,
      "clicks": 3,
      "conversations": 1
    },
    {
      "date": "2026-06-08",
      "adSetId": "as-bc-3-emirates",
      "country": "AE",
      "spend": 158.65,
      "impressions": 314,
      "reach": 209,
      "clicks": 3,
      "conversations": 1
    },
    {
      "date": "2026-06-09",
      "adSetId": "as-bc-3-emirates",
      "country": "AE",
      "spend": 158.65,
      "impressions": 314,
      "reach": 209,
      "clicks": 2,
      "conversations": 1
    },
    {
      "date": "2026-06-10",
      "adSetId": "as-bc-3-emirates",
      "country": "AE",
      "spend": 158.65,
      "impressions": 314,
      "reach": 209,
      "clicks": 2,
      "conversations": 1
    },
    {
      "date": "2026-06-11",
      "adSetId": "as-bc-3-emirates",
      "country": "AE",
      "spend": 158.65,